<?xml version="1.0" encoding="UTF-8"?><tns:BeerList xmlns:xsi="http://www.w3.org/2001/XMLSchema-instance" xmlns:tns="https://www.example.org/BeerList" xsi:schemaLocation="http://www.example.org/BeerList beer.xsd "><tns:Beer id="id1"><tns:Title>Baltika 7</tns:Title><tns:BeerType>Light</tns:BeerType><tns:Al>true</tns:Al><tns:Manufacturer>Baltika</tns:Manufacturer><tns:Chars><tns:Filtered>true</tns:Filtered><tns:Calories>216.0</tns:Calories><tns:TypeOfFilling><tns:MaterialType>Steel</tns:MaterialType><tns:Volume>0.33</tns:Volume></tns:TypeOfFilling><tns:NumberOfTurns>12.0</tns:NumberOfTurns><tns:Tranparency>16%</tns:Tranparency></tns:Chars><tns:Ingridients><tns:Ingridient><tns:IngrideintName>Water</tns:IngrideintName><tns:Amount>130.0</tns:Amount></tns:Ingridient><tns:Ingridient><tns:IngrideintName>Sugar</tns:IngrideintName><tns:Amount>13.0</tns:Amount></tns:Ingridient><tns:Ingridient><tns:IngrideintName>Malt</tns:IngrideintName><tns:Amount>54.0</tns:Amount></tns:Ingridient></tns:Ingridients></tns:Beer><tns:Beer id="id2"><tns:Title>Белый медведь</tns:Title><tns:BeerType>Porter</tns:BeerType><tns:Al>true</tns:Al><tns:Manufacturer>Россия</tns:Manufacturer><tns:Chars><tns:Filtered>true</tns:Filtered><tns:Calories>333.0</tns:Calories><tns:TypeOfFilling><tns:MaterialType>Plastic</tns:MaterialType><tns:Volume>1.5</tns:Volume></tns:TypeOfFilling><tns:NumberOfTurns>5.0</tns:NumberOfTurns><tns:Tranparency>40%</tns:Tranparency></tns:Chars><tns:Ingridients><tns:Ingridient><tns:IngrideintName>Water</tns:IngrideintName><tns:Amount>130.0</tns:Amount></tns:Ingridient><tns:Ingridient><tns:IngrideintName>Sugar</tns:IngrideintName><tns:Amount>13.0</tns:Amount></tns:Ingridient><tns:Ingridient><tns:IngrideintName>Malt</tns:IngrideintName><tns:Amount>54.0</tns:Amount></tns:Ingridient></tns:Ingridients></tns:Beer><tns:Beer id="id3"><tns:Title>Охота крепкое</tns:Title><tns:BeerType>Lager</tns:BeerType><tns:Al>true</tns:Al><tns:Manufacturer>Россия</tns:Manufacturer><tns:Chars><tns:Filtered>false</tns:Filtered><tns:Calories>200.0</tns:Calories><tns:TypeOfFilling><tns:MaterialType>Plastic</tns:MaterialType><tns:Volume>2.5</tns:Volume></tns:TypeOfFilling><tns:NumberOfTurns>5.0</tns:NumberOfTurns><tns:Tranparency>16%</tns:Tranparency></tns:Chars><tns:Ingridients><tns:Ingridient><tns:IngrideintName>Water</tns:IngrideintName><tns:Amount>110.0</tns:Amount></tns:Ingridient><tns:Ingridient><tns:IngrideintName>Sugar</tns:IngrideintName><tns:Amount>13.0</tns:Amount></tns:Ingridient></tns:Ingridients></tns:Beer></tns:BeerList>