<?xml version="1.0" encoding="UTF-8"?>
<tns:BeerList xmlns:tns="https://www.example.org/BeerList"
	xmlns:xsi="http://www.w3.org/2001/XMLSchema-instance"
	xsi:schemaLocation="https://www.example.org/BeerList beer.xsd ">
	<tns:Beer id="id3">
		<tns:Title>Охота крепкое</tns:Title>
		<tns:BeerType>Lager</tns:BeerType>
		<tns:Al>true</tns:Al>
		<tns:Manufacturer>Россия</tns:Manufacturer>
		<tns:Chars>
			<tns:Filtered>false</tns:Filtered>
			<tns:Calories>200</tns:Calories>
			<tns:TypeOfFilling>
				<tns:Volume>2.5</tns:Volume>
				<tns:MaterialType>Plastic</tns:MaterialType>
			</tns:TypeOfFilling>
			<tns:NumberOfTurns>5</tns:NumberOfTurns>
			<tns:Tranparency>16%</tns:Tranparency>
		</tns:Chars>
		<tns:Ingridients>
			<tns:Ingridient>
				<tns:IngrideintName>Water</tns:IngrideintName>
				<tns:Amount>110</tns:Amount>
			</tns:Ingridient>
			<tns:Ingridient>
				<tns:IngrideintName>Sugar</tns:IngrideintName>
				<tns:Amount>13</tns:Amount>
			</tns:Ingridient>
		</tns:Ingridients>
	</tns:Beer>
	<tns:Beer id="id1">
		<tns:Title>Baltika 7</tns:Title>
		<tns:BeerType>Light</tns:BeerType>
		<tns:Al>true</tns:Al>
		<tns:Manufacturer>Baltika</tns:Manufacturer>
		<tns:Chars>
			<tns:Filtered>true</tns:Filtered>
			<tns:Calories>216</tns:Calories>
			<tns:TypeOfFilling>
				<tns:Volume>0.33</tns:Volume>
				<tns:MaterialType>Steel</tns:MaterialType>
			</tns:TypeOfFilling>
			<tns:NumberOfTurns>12</tns:NumberOfTurns>
			<tns:Tranparency>16%</tns:Tranparency>
		</tns:Chars>
		<tns:Ingridients>
			<tns:Ingridient>
				<tns:IngrideintName>Water</tns:IngrideintName>
				<tns:Amount>130</tns:Amount>
			</tns:Ingridient>
			<tns:Ingridient>
				<tns:IngrideintName>Sugar</tns:IngrideintName>
				<tns:Amount>13</tns:Amount>
			</tns:Ingridient>
			<tns:Ingridient>
				<tns:IngrideintName>Malt</tns:IngrideintName>
				<tns:Amount>54</tns:Amount>
			</tns:Ingridient>
		</tns:Ingridients>
	</tns:Beer>
	<tns:Beer id="id2">
		<tns:Title>Белый медведь</tns:Title>
		<tns:BeerType>Porter</tns:BeerType>
		<tns:Al>true</tns:Al>
		<tns:Manufacturer>Россия</tns:Manufacturer>
		<tns:Chars>
			<tns:Filtered>true</tns:Filtered>
			<tns:Calories>333</tns:Calories>
			<tns:TypeOfFilling>
				<tns:Volume>1.5</tns:Volume>
				<tns:MaterialType>Plastic</tns:MaterialType>
			</tns:TypeOfFilling>
			<tns:NumberOfTurns>5</tns:NumberOfTurns>
			<tns:Tranparency>40%</tns:Tranparency>
		</tns:Chars>
		<tns:Ingridients>
			<tns:Ingridient>
				<tns:IngrideintName>Water</tns:IngrideintName>
				<tns:Amount>130</tns:Amount>
			</tns:Ingridient>
			<tns:Ingridient>
				<tns:IngrideintName>Sugar</tns:IngrideintName>
				<tns:Amount>13</tns:Amount>
			</tns:Ingridient>
			<tns:Ingridient>
				<tns:IngrideintName>Malt</tns:IngrideintName>
				<tns:Amount>54</tns:Amount>
			</tns:Ingridient>
		</tns:Ingridients>
	</tns:Beer>
	


</tns:BeerList>